Codec: Realtek ALC287
Address: 0
AFG Function Id: 0x1 (unsol 1)
Vendor Id: 0x10ec0287
Subsystem Id: 0x17aa38f9
Revision Id: 0x100002
No Modem Function Group found
Default PCM:
    rates [0x560]: 44100 48000 96000 192000
    bits [0xe]: 16 20 24
    formats [0x1]: PCM
Default Amp-In caps: N/A
Default Amp-Out caps: N/A
State of AFG node 0x01:
  Power states:  D0 D1 D2 D3 D3cold CLKSTOP EPSS
  Power: setting=D0, actual=D0
GPIO: io=5, o=0, i=0, unsolicited=1, wake=0
  IO[0]: enable=0, dir=0, wake=0, sticky=0, data=0, unsol=0
  IO[1]: enable=0, dir=0, wake=0, sticky=0, data=0, unsol=0
  IO[2]: enable=0, dir=0, wake=0, sticky=0, data=0, unsol=0
  IO[3]: enable=0, dir=0, wake=0, sticky=0, data=0, unsol=0
  IO[4]: enable=0, dir=0, wake=0, sticky=0, data=0, unsol=0
Node 0x02 [Audio Output] wcaps 0x41d: Stereo Amp-Out
  Control: name="Speaker Playback Volume", index=0, device=0
    ControlAmp: chs=3, dir=Out, idx=0, ofs=0
  Amp-Out caps: ofs=0x57, nsteps=0x57, stepsize=0x02, mute=0
  Amp-Out vals:  [0x29 0x29]
  Converter: stream=1, channel=0
  PCM:
    rates [0x40]: 48000
    bits [0xe]: 16 20 24
    formats [0x1]: PCM
  Power states:  D0 D1 D2 D3 EPSS
  Power: setting=D0, actual=D0
Node 0x03 [Audio Output] wcaps 0x41d: Stereo Amp-Out
  Control: name="Headphone Playback Volume", index=0, device=0
    ControlAmp: chs=3, dir=Out, idx=0, ofs=0
  Amp-Out caps: ofs=0x57, nsteps=0x57, stepsize=0x02, mute=0
  Amp-Out vals:  [0x29 0x29]
  Converter: stream=1, channel=0
  PCM:
    rates [0x40]: 48000
    bits [0xe]: 16 20 24
    formats [0x1]: PCM
  Power states:  D0 D1 D2 D3 EPSS
  Power: setting=D0, actual=D0
Node 0x04 [Vendor Defined Widget] wcaps 0xf00000: Mono
Node 0x05 [Vendor Defined Widget] wcaps 0xf00000: Mono
Node 0x06 [Audio Output] wcaps 0x411: Stereo
  Converter: stream=0, channel=0
  PCM:
    rates [0x40]: 48000
    bits [0xe]: 16 20 24
    formats [0x1]: PCM
  Power states:  D0 D1 D2 D3 EPSS
  Power: setting=D0, actual=D0
Node 0x07 [Audio Input] wcaps 0x10051b: Stereo Amp-In
  Amp-In caps: ofs=0x17, nsteps=0x3f, stepsize=0x02, mute=1
  Amp-In vals:  [0x97 0x97]
  Converter: stream=0, channel=0
  SDI-Select: 0
  PCM:
    rates [0x40]: 48000
    bits [0xe]: 16 20 24
    formats [0x1]: PCM
  Power states:  D0 D1 D2 D3 EPSS
  Power: setting=D0, actual=D0
  Connection: 1
     0x24
Node 0x08 [Audio Input] wcaps 0x10051b: Stereo Amp-In
  Control: name="Capture Volume", index=0, device=0
    ControlAmp: chs=3, dir=In, idx=0, ofs=0
  Control: name="Capture Switch", index=0, device=0
    ControlAmp: chs=3, dir=In, idx=0, ofs=0
  Amp-In caps: ofs=0x17, nsteps=0x3f, stepsize=0x02, mute=1
  Amp-In vals:  [0x80 0x80]
  Converter: stream=0, channel=0
  SDI-Select: 0
  PCM:
    rates [0x560]: 44100 48000 96000 192000
    bits [0xe]: 16 20 24
    formats [0x1]: PCM
  Power states:  D0 D1 D2 D3 EPSS
  Power: setting=D0, actual=D0
  Connection: 1
     0x23
Node 0x09 [Audio Input] wcaps 0x10051b: Stereo Amp-In
  Amp-In caps: ofs=0x17, nsteps=0x3f, stepsize=0x02, mute=1
  Amp-In vals:  [0x97 0x97]
  Converter: stream=0, channel=0
  SDI-Select: 0
  PCM:
    rates [0x560]: 44100 48000 96000 192000
    bits [0xe]: 16 20 24
    formats [0x1]: PCM
  Power states:  D0 D1 D2 D3 EPSS
  Power: setting=D0, actual=D0
  Connection: 1
     0x22
Node 0x0a [Audio Input] wcaps 0x10051b: Stereo Amp-In
  Amp-In caps: ofs=0x17, nsteps=0x3f, stepsize=0x02, mute=1
  Amp-In vals:  [0x97 0x97]
  Converter: stream=0, channel=0
  SDI-Select: 0
  PCM:
    rates [0x40]: 48000
    bits [0xe]: 16 20 24
    formats [0x1]: PCM
  Power states:  D0 D1 D2 D3 EPSS
  Power: setting=D0, actual=D0
  Connection: 1
     0x25
Node 0x0b [Vendor Defined Widget] wcaps 0xf00000: Mono
Node 0x0c [Vendor Defined Widget] wcaps 0xf00000: Mono
Node 0x0d [Vendor Defined Widget] wcaps 0xf00000: Mono
Node 0x0e [Vendor Defined Widget] wcaps 0xf00000: Mono
Node 0x0f [Vendor Defined Widget] wcaps 0xf00000: Mono
Node 0x10 [Vendor Defined Widget] wcaps 0xf00000: Mono
Node 0x11 [Vendor Defined Widget] wcaps 0xf00000: Mono
Node 0x12 [Pin Complex] wcaps 0x40040b: Stereo Amp-In
  Amp-In caps: ofs=0x00, nsteps=0x03, stepsize=0x27, mute=0
  Amp-In vals:  [0x00 0x00]
  Pincap 0x00000020: IN
  Pin Default 0x40000000: [N/A] Line Out at Ext N/A
    Conn = Unknown, Color = Unknown
    DefAssociation = 0x0, Sequence = 0x0
  Pin-ctls: 0x00:
  Power states:  D0 D1 D2 D3 EPSS
  Power: setting=D0, actual=D0
Node 0x13 [Pin Complex] wcaps 0x40040b: Stereo Amp-In
  Amp-In caps: ofs=0x00, nsteps=0x03, stepsize=0x27, mute=0
  Amp-In vals:  [0x00 0x00]
  Pincap 0x00000020: IN
  Pin Default 0x411111f0: [N/A] Speaker at Ext Rear
    Conn = 1/8, Color = Black
    DefAssociation = 0xf, Sequence = 0x0
    Misc = NO_PRESENCE
  Pin-ctls: 0x00:
  Power states:  D0 D1 D2 D3 EPSS
  Power: setting=D0, actual=D0
Node 0x14 [Pin Complex] wcaps 0x40058d: Stereo Amp-Out
  Control: name="Bass Speaker Playback Switch", index=0, device=0
    ControlAmp: chs=3, dir=Out, idx=0, ofs=0
  Amp-Out caps: ofs=0x00, nsteps=0x00, stepsize=0x00, mute=1
  Amp-Out vals:  [0x00 0x00]
  Pincap 0x00010014: OUT EAPD Detect
  EAPD 0x2: EAPD
  Pin Default 0x90170120: [Fixed] Speaker at Int N/A
    Conn = Analog, Color = Unknown
    DefAssociation = 0x2, Sequence = 0x0
    Misc = NO_PRESENCE
  Pin-ctls: 0x40: OUT
  Unsolicited: tag=00, enabled=0
  Power states:  D0 D1 D2 D3 EPSS
  Power: setting=D0, actual=D0
  Connection: 1
     0x02
Node 0x15 [Vendor Defined Widget] wcaps 0xf00000: Mono
Node 0x16 [Vendor Defined Widget] wcaps 0xf00000: Mono
Node 0x17 [Pin Complex] wcaps 0x40058d: Stereo Amp-Out
  Control: name="Speaker Playback Switch", index=0, device=0
    ControlAmp: chs=3, dir=Out, idx=0, ofs=0
  Amp-Out caps: ofs=0x00, nsteps=0x00, stepsize=0x00, mute=1
  Amp-Out vals:  [0x00 0x00]
  Pincap 0x0000001c: OUT HP Detect
  Pin Default 0x90170120: [Fixed] Speaker at Int N/A
    Conn = Analog, Color = Unknown
    DefAssociation = 0x2, Sequence = 0x0
    Misc = NO_PRESENCE
  Pin-ctls: 0x40: OUT
  Unsolicited: tag=00, enabled=0
  Power states:  D0 D1 D2 D3 EPSS
  Power: setting=D0, actual=D0
  Connection: 4
     0x02* 0x03 0x06 0x08
  In-driver Connection: 2
     0x02 0x03
Node 0x18 [Pin Complex] wcaps 0x40048b: Stereo Amp-In
  Amp-In caps: ofs=0x00, nsteps=0x03, stepsize=0x27, mute=0
  Amp-In vals:  [0x00 0x00]
  Pincap 0x00000024: IN Detect
  Pin Default 0x411111f0: [N/A] Speaker at Ext Rear
    Conn = 1/8, Color = Black
    DefAssociation = 0xf, Sequence = 0x0
    Misc = NO_PRESENCE
  Pin-ctls: 0x00:
  Unsolicited: tag=00, enabled=0
  Power states:  D0 D1 D2 D3 EPSS
  Power: setting=D0, actual=D0
Node 0x19 [Pin Complex] wcaps 0x40048b: Stereo Amp-In
  Control: name="Mic Boost Volume", index=0, device=0
    ControlAmp: chs=3, dir=In, idx=0, ofs=0
  Amp-In caps: ofs=0x00, nsteps=0x03, stepsize=0x27, mute=0
  Amp-In vals:  [0x00 0x00]
  Pincap 0x00003724: IN Detect
    Vref caps: HIZ 50 GRD 80 100
  Pin Default 0x03a11030: [Jack] Mic at Ext Left
    Conn = 1/8, Color = Black
    DefAssociation = 0x3, Sequence = 0x0
  Pin-ctls: 0x24: IN VREF_80
  Unsolicited: tag=03, enabled=1
  Power states:  D0 D1 D2 D3 EPSS
  Power: setting=D0, actual=D0
Node 0x1a [Pin Complex] wcaps 0x40048b: Stereo Amp-In
  Amp-In caps: ofs=0x00, nsteps=0x03, stepsize=0x27, mute=0
  Amp-In vals:  [0x00 0x00]
  Pincap 0x00003724: IN Detect
    Vref caps: HIZ 50 GRD 80 100
  Pin Default 0x411111f0: [N/A] Speaker at Ext Rear
    Conn = 1/8, Color = Black
    DefAssociation = 0xf, Sequence = 0x0
    Misc = NO_PRESENCE
  Pin-ctls: 0x00: VREF_HIZ
  Unsolicited: tag=00, enabled=0
  Power states:  D0 D1 D2 D3 EPSS
  Power: setting=D0, actual=D0
Node 0x1b [Pin Complex] wcaps 0x40058f: Stereo Amp-In Amp-Out
  Amp-In caps: ofs=0x00, nsteps=0x03, stepsize=0x27, mute=0
  Amp-In vals:  [0x00 0x00]
  Amp-Out caps: ofs=0x00, nsteps=0x00, stepsize=0x00, mute=1
  Amp-Out vals:  [0x80 0x80]
  Pincap 0x00013734: IN OUT EAPD Detect
    Vref caps: HIZ 50 GRD 80 100
  EAPD 0x2: EAPD
  Pin Default 0x411111f0: [N/A] Speaker at Ext Rear
    Conn = 1/8, Color = Black
    DefAssociation = 0xf, Sequence = 0x0
    Misc = NO_PRESENCE
  Pin-ctls: 0x00: VREF_HIZ
  Unsolicited: tag=00, enabled=0
  Power states:  D0 D1 D2 D3 EPSS
  Power: setting=D0, actual=D0
  Connection: 2
     0x02* 0x03
Node 0x1c [Vendor Defined Widget] wcaps 0xf00000: Mono
Node 0x1d [Pin Complex] wcaps 0x400400: Mono
  Pincap 0x00000020: IN
  Pin Default 0x40471a6d: [N/A] SPDIF Out at Ext N/A
    Conn = Analog, Color = Black
    DefAssociation = 0x6, Sequence = 0xd
  Pin-ctls: 0x20: IN
  Power states:  D0 D1 D2 D3 EPSS
  Power: setting=D0, actual=D0
Node 0x1e [Pin Complex] wcaps 0x400501: Stereo
  Pincap 0x00000010: OUT
  Pin Default 0x411111f0: [N/A] Speaker at Ext Rear
    Conn = 1/8, Color = Black
    DefAssociation = 0xf, Sequence = 0x0
    Misc = NO_PRESENCE
  Pin-ctls: 0x40: OUT
  Power states:  D0 D1 D2 D3 EPSS
  Power: setting=D0, actual=D0
  Connection: 1
     0x06
Node 0x1f [Vendor Defined Widget] wcaps 0xf00000: Mono
Node 0x20 [Vendor Defined Widget] wcaps 0xf00040: Mono
  Processing caps: benign=0, ncoeff=142
    Coeff 0x00: 0x0002
    Coeff 0x01: 0xaaaa
    Coeff 0x02: 0x8aaa
    Coeff 0x03: 0x0002
    Coeff 0x04: 0xaa89
    Coeff 0x05: 0x0700
    Coeff 0x06: 0x6115
    Coeff 0x07: 0x0200
    Coeff 0x08: 0x4ab7
    Coeff 0x09: 0x0000
    Coeff 0x0a: 0x777a
    Coeff 0x0b: 0x7779
    Coeff 0x0c: 0x813f
    Coeff 0x0d: 0xa023
    Coeff 0x0e: 0x65c0
    Coeff 0x0f: 0x02a2
    Coeff 0x10: 0x8906
    Coeff 0x11: 0x0000
    Coeff 0x12: 0x0000
    Coeff 0x13: 0x2200
    Coeff 0x14: 0x0000
    Coeff 0x15: 0x0000
    Coeff 0x16: 0x0000
    Coeff 0x17: 0x0000
    Coeff 0x18: 0x0000
    Coeff 0x19: 0x2c91
    Coeff 0x1a: 0x8003
    Coeff 0x1b: 0x0a6b
    Coeff 0x1c: 0x0000
    Coeff 0x1d: 0x0000
    Coeff 0x1e: 0x0000
    Coeff 0x1f: 0x0000
    Coeff 0x20: 0x1000
    Coeff 0x21: 0x0000
    Coeff 0x22: 0x0000
    Coeff 0x23: 0x8804
    Coeff 0x24: 0x0000
    Coeff 0x25: 0x0000
    Coeff 0x26: 0x0000
    Coeff 0x27: 0x0000
    Coeff 0x28: 0x0000
    Coeff 0x29: 0x3000
    Coeff 0x2a: 0x0000
    Coeff 0x2b: 0x0000
    Coeff 0x2c: 0x0f00
    Coeff 0x2d: 0x1f4f
    Coeff 0x2e: 0x290e
    Coeff 0x2f: 0xef57
    Coeff 0x30: 0x9004
    Coeff 0x31: 0x80c0
    Coeff 0x32: 0x50a8
    Coeff 0x33: 0x8580
    Coeff 0x34: 0xa281
    Coeff 0x35: 0x8daa
    Coeff 0x36: 0x7151
    Coeff 0x37: 0xfe05
    Coeff 0x38: 0x7909
    Coeff 0x39: 0x330a
    Coeff 0x3a: 0x0010
    Coeff 0x3b: 0x60d9
    Coeff 0x3c: 0xf214
    Coeff 0x3d: 0xc2ba
    Coeff 0x3e: 0xa928
    Coeff 0x3f: 0x0000
    Coeff 0x40: 0x8800
    Coeff 0x41: 0x0000
    Coeff 0x42: 0x2000
    Coeff 0x43: 0x3d97
    Coeff 0x44: 0x4500
    Coeff 0x45: 0x5289
    Coeff 0x46: 0x0404
    Coeff 0x47: 0xa47a
    Coeff 0x48: 0xd011
    Coeff 0x49: 0x0045
    Coeff 0x4a: 0x2020
    Coeff 0x4b: 0x0000
    Coeff 0x4c: 0x065c
    Coeff 0x4d: 0x7fff
    Coeff 0x4e: 0x7fff
    Coeff 0x4f: 0x0000
    Coeff 0x50: 0x0000
    Coeff 0x51: 0x5f5f
    Coeff 0x52: 0x0100
    Coeff 0x53: 0x0000
    Coeff 0x54: 0x0000
    Coeff 0x55: 0x0000
    Coeff 0x56: 0xfd00
    Coeff 0x57: 0x0000
    Coeff 0x58: 0x0000
    Coeff 0x59: 0x0000
    Coeff 0x5a: 0x0000
    Coeff 0x5b: 0x0777
    Coeff 0x5c: 0x0000
    Coeff 0x5d: 0x6000
    Coeff 0x5e: 0x4000
    Coeff 0x5f: 0x6200
    Coeff 0x60: 0x0000
    Coeff 0x61: 0x0000
    Coeff 0x62: 0x0000
    Coeff 0x63: 0xc000
    Coeff 0x64: 0x0000
    Coeff 0x65: 0x0000
    Coeff 0x66: 0x0000
    Coeff 0x67: 0xf000
    Coeff 0x68: 0x0001
    Coeff 0x69: 0x0000
    Coeff 0x6a: 0x0000
    Coeff 0x6b: 0xa394
    Coeff 0x6c: 0x7fff
    Coeff 0x6d: 0x7000
    Coeff 0x6e: 0x0000
    Coeff 0x6f: 0x0000
    Coeff 0x70: 0x0000
    Coeff 0x71: 0x0000
    Coeff 0x72: 0x0000
    Coeff 0x73: 0x0000
    Coeff 0x74: 0x0000
    Coeff 0x75: 0x4101
    Coeff 0x76: 0x8300
    Coeff 0x77: 0x001f
    Coeff 0x78: 0x0079
    Coeff 0x79: 0x0000
    Coeff 0x7a: 0x0000
    Coeff 0x7b: 0x0000
    Coeff 0x7c: 0x0000
    Coeff 0x7d: 0x0000
    Coeff 0x7e: 0x0000
    Coeff 0x7f: 0x0000
    Coeff 0x80: 0x0000
    Coeff 0x81: 0x0000
    Coeff 0x82: 0x0000
    Coeff 0x83: 0x0000
    Coeff 0x84: 0x0000
    Coeff 0x85: 0x0000
    Coeff 0x86: 0x0000
    Coeff 0x87: 0x0000
    Coeff 0x88: 0x0000
    Coeff 0x89: 0x0000
    Coeff 0x8a: 0x0000
    Coeff 0x8b: 0x0000
    Coeff 0x8c: 0xff80
    Coeff 0x8d: 0x0000
Node 0x21 [Pin Complex] wcaps 0x40058d: Stereo Amp-Out
  Control: name="Headphone Playback Switch", index=0, device=0
    ControlAmp: chs=3, dir=Out, idx=0, ofs=0
  Amp-Out caps: ofs=0x00, nsteps=0x00, stepsize=0x00, mute=1
  Amp-Out vals:  [0x00 0x00]
  Pincap 0x0001001c: OUT HP EAPD Detect
  EAPD 0x2: EAPD
  Pin Default 0x03211010: [Jack] HP Out at Ext Left
    Conn = 1/8, Color = Black
    DefAssociation = 0x1, Sequence = 0x0
  Pin-ctls: 0xc0: OUT HP
  Unsolicited: tag=02, enabled=1
  Power states:  D0 D1 D2 D3 EPSS
  Power: setting=D0, actual=D0
  Connection: 2
     0x02 0x03*
Node 0x22 [Audio Mixer] wcaps 0x20010b: Stereo Amp-In
  Amp-In caps: ofs=0x00, nsteps=0x00, stepsize=0x00, mute=1
  Amp-In vals:  [0x80 0x80] [0x80 0x80] [0x80 0x80] [0x80 0x80] [0x80 0x80]
  Connection: 5
     0x19 0x1a 0x1b 0x1d 0x13
Node 0x23 [Audio Mixer] wcaps 0x20010b: Stereo Amp-In
  Amp-In caps: ofs=0x00, nsteps=0x00, stepsize=0x00, mute=1
  Amp-In vals:  [0x00 0x00] [0x80 0x80] [0x80 0x80] [0x80 0x80] [0x80 0x80]
  Connection: 5
     0x19 0x1a 0x1b 0x1d 0x12
Node 0x24 [Audio Selector] wcaps 0x300101: Stereo
  Connection: 3
     0x12* 0x13 0x18
Node 0x25 [Audio Selector] wcaps 0x300101: Stereo
  Connection: 2
     0x12* 0x13
